<?xml version="1.0" encoding="UTF-8"?>
<BigVir2084 xmlns:xsi="http://www.w3.org/2001/XMLSchema-instance"
      xsi:noNamespaceSchemaLocation="BigVir2084.xsd">
    <Utilisateur_Personne id="1">
        <type>citoyen</type>
        <nom>Jean</nom>
        <age>18</age>
        <pois>50.5</pois>
        <antécédent_medical antécédent_medical="1"/>
        <historique_social historique_social="2"/>
        <statut statut="3"/>

    </Utilisateur_Personne>

    <Utilisateur_Groupe id="6">
        <type>agence</type>
        <nom>gov</nom>
    </Utilisateur_Groupe>

    <antécédent_medical id="1">
        <consultation>en bonne santé</consultation>
        <hospitalisation>N'ont pas été hospitalisés au cour de la dernière année</hospitalisation>
        <résultat>Negativé</résultat>
    </antécédent_medical>

    <historique_social id="2">
        <date>1998-05-20</date>
        <lieu>Antibes</lieu>
        <numInfect>8</numInfect>
    </historique_social>

    <statut id="3">
        <infection>false</infection>
        <immunisation>false</immunisation>
        <vaccination>false</vaccination>
    </statut>

</BigVir2084>